area	text
T	中共外长钱其琛在离开北京前往纽约前告诉记者美国新闻界的报导
T	卫生署国际合作组主任蔡荣福表示
M	而苏联最近提出的东西方在１９９５年完全撤走驻外国的军队的建议
M	海湾危机更是矛盾多端
T	傅国强在第三局最后一球腿部抽筋救球不及
M	代表不同利益集团的国会议员之间必将有一场严重的较量
M	多上交国家用于补贴文化事业经费３７．８万元
M	不是不顾条件的蛮干
T	建于十五世纪明成祖永乐年间
T	另外饰演祝英台的女主角
M	无疑是双重的致命打击
T	高档果然不少获利回吐及解套卖压出笼
M	傍晚行路不至于就遭打劫
M	苏联最迟可在１９９１年底全部撤军
M	在１１５天的紧张施工中
M	还将多层次多渠道地拓宽合作领域
M	立式加了３个抽屉
M	于是用户都转而去买乡镇企业生产的寿命短但价格低的产品
M	广大发展中国家的生态破坏之所以严重
T	墓葬中还首次发现结构完备的玉饰
M	比去年同期增长２３％以上
T	而国内的总投资为八十四亿元
M	大个的苏联汽车专家比力亨
T	自年初以来均以观望态度因应之
M	整个电视塔将向世人亮相
M	在艰苦生活中人与人之间的互爱互助
M	今年三四月份又被调回收费站
T	规模大使得经济规模更具效益
M	主张必须要有一股抗衡的力量
M	绝不是为了废除种族制度
T	企业往往能找到优秀的人才
M	要把这些方针政策和措施真正落到实处
M	沈太福便想到了海口的歌舞厅
M	下面的班子谁还闹摩擦
T	推行了这两项有意义的活动
M	原是临大路的一个村庄
M	新当选的总经理宋鸿柏清楚地意识到承包仅仅是所有权与经营权的分离
M	更要发动群众提合理化建议
M	山西省铁路部门积极挖潜扩能
M	开始算清了为那九十万斤粮票他应付出的巨大代价
M	那为啥现在还没维修好
M	其天职是为人民服务
M	才可能集中适当力量加快西部地区工作
T	由于基隆港外海的风浪六到七级
T	干员首先在中正路四０一号七楼之十五查获少年谭杰十七岁
M	防汛是每位市民的应尽职责
T	则已是不争的事实
T	至于今年要邀请日本那一支职棒来华
T	佛教更是外来文化的一大冲击
M	有两个在本县工作
M	困皮根本不可能有任何画面
M	一个青年妇女来到乔石面前
M	持别是少数领导干部
M	制止滥发各种奖券的现象
T	国内篮球幼苗的确年年表现十足的潜力
T	使公害防治小组成员面对满目疮痍的河床感到痛心
M	他对陵园工作人员说
T	馆内除了展览物品之外
M	走不上三五步就又被人围上
M	纷纷向证券柜台工作人员索要１９９０年国库券个人认购缴款单
M	南非当局的这一积极举动在国内外受到广泛欢迎
T	甚至产生冷战后历史已告终结
T	二氧化碳占了大气中的９６．５％
T	我们要怎样建立一颗平常心呢
T	陈金茂在职棒元年球季结束的打击率为二成九五
T	院士会议后七月八日九日为吴前院长荣退学术演讲会
M	年产８０万吨优质薄板的现代化冷连轧机组轧出了一卷卷优质薄板
M	我市的反腐败斗争一定能取得预期的胜利
T	他是要采取极端主义
T	台风登陆的方向与次数
M	就成了第７轮谈判能否圆满成功的关键
M	所以你们要经常下来跑跑
T	民国初年仍设都于此
M	又步行了近２公里的坑道
M	也是军事理论的较量
T	其它不押韵的句尾字有时是句首
T	为使此类研究成果
M	探明时间要长得多
T	拥有多年实际艺术品拍卖会经验的苏富比
T	由于一般老鼠不够干净
T	此一作业系统的推出
T	野莺的雄鸟喉部是一片的鲜红色
M	解决了锦纶丝水分较大的问题
M	阿沛副委员长走出档案馆
T	而且韵字有一定的平仄
T	运用教学录影带声音训练和穿衣风格指导等工具
T	所属擅离职守时即可能受到公务员惩戒法
T	形成左右对称的气流循环
M	目前武汉长江大堤的总长度比１９４９年增长近两倍
M	在世界格局发生重大的转折性变化之际
M	另一方面帮助农村乡镇企业调整产品结构
M	省农行通过对全省乡镇企业进行全面信用等级评定
M	他还将会晤联合国秘书长佩雷斯·德奎利亚尔
T	甚至在全程出现不少民众问候郝院长新加坡之旅累不累这类温馨镜头
M	这儿的工作比托儿所难做
T	因此见诸文字者尚不多
T	就要付出高成本的建设费用了
T	那么文化意义的中国人也就是广义的华人面对一三五七九的论说应如何自处呢
T	是即刻可以把台湾的处境推向危险的悬崖之上
M	纷纷涌向作为科威特象征的大塔附近的海湾大道
M	除鞍山本溪盘锦三市固有鞍钢本钢辽河化肥厂三个盈利大户支撑外
M	曾用两年多为党培养了近千名妇女干部
M	很显然上述各种力量是不同的
M	经济发展曾经居全国前列的东北三省近年来工业生产步履维艰
M	有多少市民和过往旅客要乘车乘船南行北往
T	除了店里摆售的书外
T	订婚大多以喜饼代替猪只
T	有三项快速发展且深具影响力的力量进入了商业的竞技场全面品质管理新技术及劳工多元化这样的工作重组方法都需要较高水准的语言数学及推理技巧
T	傅国强以十五比十三获胜
M	引导群众认识安定团结的重要性并付之行动
M	要根据我们的任务和目标
T	以满足消费者比上不足
M	黎某在天益村所建的私人住宅
M	两者之间的期限为一年
M	人们是会感谢他们的
M	并责令银行采取各种灵活有效的手段搞活储蓄
M	这种放松银根政策的目的
M	但是我们学雷锋的时候要学他的精神
M	不要看到别人赚钱就眼红
T	反而能发挥杰出的能力
T	林嫌因慌张而机车倒地
M	但由于电子信息技术的落后
T	除了以幻灯片介绍泰雅文化教唱最后一天晚会要表演的山地歌舞和学习泰雅语
T	连结时与本端使用者有相同的执行功能
M	一海湾战争结束美国人消费和投资由消极转为积极
M	一个拾起地上的一块砖头
M	安盟主张停火日要同大选日相联系
T	十一日南韩官员北上至平壤第二次会谈时
M	该城市民及人大代表不堪其苦与其辱
M	只好来找你们消息灵通人士打听打听
M	他又从北京长城公司集资部提１００万元
T	经查证失踪之闽平渔五一二九
M	在与日美竞争中曾造成经济上很大的被动局面
T	加州一些经济预测专家指出
M	一边扫着地上的积水
M	持续了１４年的安哥拉国内战争
M	又用刀逼迫事主拿钱不遂被人穷追的
M	献给党的好干部焦裕禄同志
T	移至该处弃尸焚烧
T	盼另辟路线兴建快速道路
M	似春雷在心头滚过
T	使生医所能发展到正式成所
M	但是我永远也忘不了老师同学和周围的人给了我妈妈一样的爱
M	内地的社会主义现代化建设不但为香港提供更多的投资机会
M	辽宁人不善于把奖牌变为名牌
T	只图卖选票的戋戋之数
M	人们还提出这样一个问题
M	一些从京返回的同学把一时一地的现象当成整体形象了
M	谁要撅折一根树枝
T	新竹县议会在本届第二次定期大会中成立的调查县境及河川采掘砂石弊端专案小组
M	是世界人民面临的一个重大课题
M	一位护士正为坐在藤椅里晒太阳的病人洗脚
T	妇援会希望这项活动能深入各社区及团体
T	昨晨在彭佳屿附近查获企图从事海上交易的五艘大陆渔船
M	本报许多读者也认为应该讨论一下长虹现象
T	王扶林认为实际上在电影
M	双方还在自由使用渔业资源货车过境运输建立协调发展基金等问题上存在着比较严重的分歧
M	在船上点亮了所有的信号灯标志灯探照灯
M	深信中央和省能够赋予特区更大的试验权
M	他前住市政府信访接待站
M	各种门类的科技人员和专门人才相对较为齐全
M	我们完全有信心继续走在全国改革开发的前列
T	甚至因为许多临时加入演出的团体使得节目爆满
T	引擎的排气量是９００ｃｃ
T	因而花在以上两项的费用将近五万元
M	祥云国货精品商场创立的初衷是为了弘扬民族精神振兴民族工业
T	一般上班族的主力餐盒为六十元左右
M	彩电成为我国市场上最紧俏的商品
T	造成地球表面温度上升的现象
T	他已经要求代表会主席林保漳代为邀请全体代表聚会
T	其下分为六组各别处理金融政策与制度
T	伊拉克至少还需数月才能造出一枚简陋的核子武器
M	五厂长经理按规定比例提出业务活动基金的支配费用
M	为了肩负起这个新的历史使命
T	过一种轻松的生活
T	购物在尼泊尔是一大学问
T	你甚至丧失对自己的信心
M	既固定保护水草的根
T	在身心方面应尽量求其平衡平静
M	条约的最终签署还面临着不少困难
M	在汽车离开该县市时
T	此事已经获得省主席宋楚瑜的重视
T	其中的四十九个打点及六支全垒打在队中都是排名第二
T	收费及配送成了最大的挑战
T	余女士某些有关改善此一缺失的提议
T	夜晚突然一阵狂风袭来
M	且听南轧厂厂长丁国良的回答
T	也因此ＷＷＷ网路在两三年内会更加的盛行
T	旅馆业界及各观光点应加速计划开拓韩国旅游市场
M	竞争对手如林的情况下不是件容易事
T	黑松公司撤销对方的商标专用权
T	每年颇引人注目的国防馆
M	好眼睛也变近视了
M	竟没有发现一件完整的物品
T	否则不可对外透露评议内容
T	东海社会系教授黄金麟日前发起全校联署声明
M	唐启文负责施工的项目不下几十个
T	但是却住在非人性的环境里
M	但企业的领导者也要有群众观点
T	若能克制内在激动的情绪
T	在主从架构的伺服端
T	会让员工们感受到这是工作中重要而持续的一部份
M	关于这个议题本次会议做原则通过
M	由于苏联对西欧不再构成威胁和华约实际上已瓦解
T	亦可拥有祈福航海平安的顺风旗
T	整个国家实际上有如一个巨大的冰窖
M	工业巨人步履蹒跚行动迟滞的反常表现
T	而一交通部官员则指出
M	积压着１８万辆自行车７２万只手表１．２万台冰箱
M	祝第四次全国环境监测工作会议召开
M	而这座桥却是在桥墩上先浇一块零号块
T	再由各大学自订入学考试方式
T	因价格是依少女年龄
T	并于垃圾场内捡拾破烂
M	由于上海市演出公司经营方针明确
T	同时企业经理人对未来三年内的政局安定有百分之七十一点六
T	在于前者必须广泛参加高中的各种活动
M	笼统地表示支持也无不可
T	唐妈妈从事幼教工作十八年
T	没有理由忽视学生权益的
M	袋内有几条鱼
T	但南一段路线全程可能有两天缺水
M	也许这项工作会遇到许多困难
T	未来若是法人机构持续观望
M	这次组阁在哪里卡壳了呢
M	大联合应以实施内阁制为前提
M	面带微笑地对周围的人说
T	但是台湾人成功的保留人与人的关系
T	那么这些基于私法关系聘雇之公务员和基于公务人员任用法所任用之公务人员截然不同
M	为今后顺利执政清除障碍
M	地方也应从全局着眼
T	从过去一连串相思林运动邮政总局及农牧场事件
M	中国科技大学在世界科技前沿频结硕果
M	有的则将刚领出来的钞票仔细地清点着
M	两三下便制服了顽凶
T	并指摘抢注的公司不当
M	可苏州新艺鞋厂的专利产品
T	略低于更前一年七十八年的百分之四点四一
T	我们只是要读出我们自己制造的资料上的名称而已
T	本书将向读者证明
T	但仍有局部偏远及高地地区还是供水上有困难
M	对面临的变革有较强的承受力
T	主要是藉著一条可以发射无线电波的金属线
M	难道还要让滔滔溪水白白流淌么
T	他就得到不少有识之士的拥戴
M	担负着甲苯乙甲苯甲醇硫酸等化工产品的卸车装船及两种丙类危险液体产品卸船装桶储存的任务
M	爆炸主要在巴格达的周围大概二十至四十公里的地方
M	把对外开展的各种形式的活动推向一个新的更高的阶段
M	压倒了风声雨声浊浪击岸声
M	中国青年报记者马应珊新华社记者孙宁海党周
M	金银牌一直青睐着辽宁
T	陵园建于１４０９到１６４４年
T	五年制的新庄农校职业学校毕业后
T	词的魅力是与词的声韵分不开的
T	计划提供如电玩医疗保健旅游越洋电话房地产等生活资讯
M	同美国的暗地支持不无关系
M	到北京后吃穿如何不用愁
T	也看到了她沧海桑田的历史
M	不少工厂采购人员都不敢出差了
T	及依雇员管理规则进用之雇员
M	由几百台东风和卡码兹汽车组成的中苏边贸运输队
M	就在于１０年来我们党和政府在不断地适宜地推进多方面的改革
M	中国国际信托投资公司意向买进中国新技术创业投资公司５０万元面值的１９８９年国库券
M	参院和众院分庭抗礼的局面仍会继续
M	那自行车在布满碎玻璃碴和图钉的地上来回走
T	更能在他们知道自己成绩之余
M	创造出几倍于当前的国民生产总值
T	昨天在西滨公路凤坑隧道和附近已经舖上砂石级配的路段
M	只有敢怒而不敢言的份
M	关于安盟领导人萨文比未来去从的安排
M	许多干部职工是看了黄牌以后
T	被列为优先考虑的制作单位
M	并且由县国土局办理用地手续
M	冰箱噪音降到３６分贝
T	共同就中国人口有关问题相互研讨
M	回顾和讨论了国际上已经签署的国际法律文书的实施和执行情况
M	南轧人的取舍观将作为产业结构调整中出现的一种新的思维方式引起人们的关注
T	才可以结合其它地理资讯作更进一步之使用
M	比如你要让人家兴旺
M	那么一个先进的联合企业则是一只凤
T	使得这两项开发计划跃上生态环保议题焦点的
M	这是件非常有意义的事
M	多极局面是逐渐形成的
T	而林汉章是少数专业性的老板
M	数十盏矿灯聚集的光束
T	因为教授本身具有利害关系
M	机电部一位领导同志曾经指示
M	几个初中一年级的学生说
T	该公司上半年的营业利益一亿四千五百万元
M	凡演员无理索要高额报酬的也不演
T	命先拆毁山野荒田中的寺院及修行道场
T	可在后方撞击车祸中发挥功用
M	生产过剩的多属于劳动密集型产品
M	共同应付日趋复杂的国际经济大竞争
T	目前则大致维持在三十至三十五万张的水准
M	丢下一地的垃圾不打扫
T	自此即可窥见华隆集团全面作多的时刻尚未来临
T	少部分为善心人士所捐赠
M	却要攀登军队现代化建设的高峰
T	张丰绪若能继续当选连任中华奥会主席
M	便以建村砖厂办公楼为名修建的
M	登记参加今日投的有２２家企业和个人
M	南方为北方的富裕作出了巨大的贡献和牺牲
T	希望能拉回部分误买水货的顾客
T	不是电脑原件中央处理机记忆体周边设备之间互相沟通
T	而海珊的筹码愈多
M	他却感到许许多多新的不满
T	因此就公营事业而言可分为三种类型
T	比照其他县市如彰化县另辟路线施工
M	巴解组织驻突代表同苏大使会谈
T	虚伪本身就是一种道德上的纵容它是对美和忠诚的一种仿冒
M	他能够抵制花花世界的诱惑
M	黑龙江省鸡西市调查队对其当地的１８家国营商业和供销合作社零售企业做过调查
M	从黑人居住区撤出一切军队等
M	然翻遍所有现在和过去出的辞书
M	日本不仅在加速走向政治大国
M	我们每２０天只能买３０公升汽油
M	第４５条建议虽然流产了
M	本报连续报道了有关黑熊事件和野生动物保护问题
T	本案系采用规格及价格合并计分的方式进行
T	若教授都很有良知
M	不知他又在搞什么名堂
T	有时连广东省以外的中国人也觉古怪
T	则是民国七十二年向香港收藏家所购得
T	钱薇娟在国内有了知名度
M	能打败八百万国民党反动派大军
M	这种形式主义作风也是官僚主义作风
M	我一语地说开了
M	但是希望将这种撤军行动纳入裁军协议的范围
M	服装产量由１９７８年的６．７亿件跃为１９９０年的３１．５亿件
M	曾使辽宁人引为自豪的金牌产品
M	孙里村的亮衣赛被会
M	新上了一条制线流水线
T	便是有助于交替与承接的规划
T	辅佐晋文公与楚国展开城濮之战
T	只见会场内人进人出
T	对于未提出水果行执照完税证明单者
M	美国要求日本开放大米市场
T	并寻找适当的可建专用港地点
T	从十二年前余南庚先生及其他二十位院士联名提议起
T	全学期安排四个教学单元
M	如此复杂的断块油田
M	光讲自我看齐远远不够
M	是反对种族歧视斗争的胜利
M	美国今年秋天将举行中期选举
T	发生在今年元月五日莿桐乡陈宅枪击案主嫌犯杨永刚
T	东吴附近影印店的老板陈明源说
M	这绝不意味着可以忽视环境污染对儿童带来的危害
T	由于淡水高尔夫球场的旧九洞场地
T	台北县市工会并将先
T	下周有纠缠在一起的机会
T	体操等专长运动的体育交流及外籍教练的聘请
T	来卖给那些想参加大赛的改装车队
T	故宫出版的中华五千年文物集刊
T	各单位对验尿问题深感困扰
M	第二件事发生在今年上半年
M	钱塘江的涌潮是世界有名的奇观
T	也必须考虑向下延伸
T	主计处昨天公布七十九年十二月暨全年台湾地区物价变动概况指出
T	第二品牌或许不如第一品牌独特
T	可以针对想重新入学的人们做测试
T	上周一却突然逆转强势
T	由于产业投资减少大型标案竞争激烈
T	融资曾出现四百九十八亿元的水准
T	就改接专案导向的临时性工作
T	他将在十日左右截止收件
M	海口无轨火车站是目前全国规模最大票额最多的无轨车站
T	且自前年相思林运动后
M	虽只持续了８个小时
M	经济建设改革开放部不可能按照既定目标稳步发展
T	胡先生的一生极其丰富
M	我们一定要有足够的清醒认识
T	写词成了后世的难事
M	共用的洗手间成了狗澡堂
M	大会又进行了一个多小时
T	而导致好的显示卡及萤幕无法享用高品质的画质输出
T	而近几个月以来
T	所以应该尊重他们的设计
T	中华奥会主席张丰绪将于十一月中旬受邀前往匈牙利奥会进行为期一周的访问
T	在全国一片扫除安非他命的声浪中
M	双方深入讨论了叙利亚军队撤出贝鲁特地区叙军重新在黎巴嫩部署加紧控制黎巴嫩边界防止非黎巴嫩人非法进入以及尽早结束赫拉维总统同基督教强硬派领导人奥恩将军对峙局面的办法等问题
M	并取得了一定的成效
M	原油产量占全国的９０％以上
T	是属于影像处理的应用领域
M	婴儿的畸形率痴呆率早产率相当高
M	价格比进口的便宜三分之一
M	脚蹬的深筒胶鞋灌进了泥水
T	北原会总干事台湾大学医学系三年级卑南族学生林文斌说
M	一只纯种的中式家乡鸡
T	一般人都是买得快用得快看得快
T	林汉章对台湾史的了解甚至比中央研究院的学者高明
T	这种仇恨的心理很难消失
M	而是客观环境和条件使然
M	而对新面料新款式新工艺表现出浓厚的兴趣
M	十分了解基层干部和群众的心情
M	就是贯彻全国两会精神的动员会落实会会议把抓住机遇
M	联合执政局面还有可能出现
M	沙米尔讲话的意图在于要把这９７万巴勒斯坦人赶到东岸约旦去
T	如何形成此决定备受争议
M	为她举办了这个祝你悄悄长大生日班会
T	做什么事都要先订明细的预定表
T	这时如果牠敢再继续接近
T	也有业内人士认为
T	４高血压及糖尿病的人
M	南方国家年均经济增长率仅为百分之二点四
T	在营队的第一天和最后一天
T	各系必须审核大四学生七个学期的成绩及第八学期的选课单
T	虽然文艺中心总干事孙英凯声明尚未接到国防部的正式指示
T	从最初各单位互踢皮球
T	佰龙在与普雷合作后
T	观测为一项极为重要的工作
M	对此必须有一个清醒的认识
M	同期声江泽民总书记说
M	昔日在全国显赫一时辽宁引为自豪的丹东手表金笔营口幸福牌钢琴友谊牌洗衣机沈阳的机床等
T	以为追求到学位就等于拥有了知识
T	每一单位核评甲等人员比例
M	行色匆匆地走向北京首都机场入口处
T	同时并当场逮获涉嫌提供场地抽头的屋主蔡福安
M	黎某为什么能公然无视国家和政府的法令
T	新生可以依照转宿规定转宿到其他宿舍
M	我们的软硬件基础和内外部条件均已非昔比
M	我们也存在着不利的甚至是严峻的一面
M	努力改变军备竞赛和军备扩散这种非建设性局面减少军备流入这个已经过分军事化的地区
M	日本对苏联东欧以及中近东国家等的出口前景并不乐观
T	恭奉之意不待言表
T	疏于锻炼身体而赶场不及
M	但不知为什么案件一直未能得到查处
M	玉璧正反两面均有图文铭刻
M	刘志祥这个人物我们早就知道
M	但见营业大厅的自动卷帘门正在慢慢向上升起
M	广西电子商场里的新鲜事２２名大学毕业生站柜台非同凡响
T	在二天的训练中
T	竟然能在一张张画布上展现奇特
T	独不论白菜为菜之王
T	定位在学习而不是服务
M	只好被送往租用的库房
M	王厂长看到台下议论不停
T	添加氧化钴则变成绿色的有色玻璃
M	这条建议暂时还难以实施
M	不仅制约着其它两大战略实施得好坏
T	大树乡代表会某位代表公开指责高雄工学院未经申请核准
M	他居然抬高了一倍多
M	小至产品说明请柬名片
T	使用先进的硫化纳电池技术
M	在南非被压迫人民和政府之间尚未达成一种解决办法之前
T	打下个球季的下半季
M	这对一个拥有近５千名职工单班日产３千多台电视机的大厂意味着什么
M	调查工作是在全省１１１６．８万框架人群１２．６万样本人群中进行的
T	一些尚在就读夜间部的工读生
M	这锤子就像砸在咱心上
M	历时四十多年的雅尔塔体制正在解体
M	都是保护野生动物的热心人
M	又存在着是统一还是吞并如何消除经济和社会等各领域里的差别等严重分歧
M	用穿土布鞋的脚踩响风笛
T	快艇在开幕战中先以九十比八十废掉沙加缅度帝王队
M	既要发展经济又要保护环境的双重压力
M	因为在这里没有什么危险
T	上面还有黄庭坚作跋
T	而具有公务员身份之劳工
M	在一国之人中本是俱有体现的
T	也许这也要看社会对故宫的期许
M	还在继续恶化两国的关系
M	将直接影响它们的贸易和货币稳定
M	禁止不正当招徕和有奖销售
M	每年确定１０个产品为预研项目
M	如果一个企业库存量过大
T	让他们对于自己与内在潜能
M	这个经还得念啊
M	为的是在分房上求得大家都能接受的公平合理
M	任何一个企业都不能群龙无首
T	该乡公所应在投标须知中载明
T	面对办公室搞政治的现象时
M	汉口车站和大轮码头两个问事处何以未安装市内直通电话每处该安的恐怕是若干部）
T	则包括各种提供连线服务的厂商
T	似乎马会全是黄明晏的功劳
T	马上和天津的几位亲戚联络
M	资金设备物资等方面的潜在力量深厚
M	他企图乘人们见财起心造成混乱
T	水泥窑又不能停止生产
M	他准备举家回四川老家探亲
M	我就是为这事提前出院的哩
M	此心态更多地表现在经济层面
T	对歌唱表演有兴趣者踊跃报名参加
T	就要热中搞起权力游戏来
T	该单位及所属各卫生机构
T	但仍切忌一味追高的疯狂举动
T	不少是目前世界知名的女高音
T	印证了该公司坚持以最新最稳定的产品提供使用者最佳选择的承诺
M	企业内部的分配就该一拉平
T	并以点三八手枪朝天空鸣枪示警
M	价格从１１６．５０谈判到１１６．２０
T	来评估世界新秩序的权力关系
T	本业第三季业绩仍未转佳
T	但随著语音的大幅度变化
T	鸦片战争以来的一百五十年
T	皮草牧场的确制造出如灰蓝
M	目前正在中东访问的美国国务卿贝克甚至准备在耶路撒冷会见巴勒斯坦代表
M	很可能是宁为鸡首不为凤尾的观念还在起作用
M	中苏两国是有着七千多公里共同边界山水相连的社会主义邻国
M	也没标明产地和生产厂家
M	这里将会出现不少问路人
T	这种作法应属陋习必须加以袪除
T	也不是这些沟通工具绝不犯错
M	经过激烈的交锋和讨价还价
M	到监狱来上人生价值这一课
M	屏幕上的价格在不断变换
M	每次都得来几种小菜
M	可是半个多小时过去了
T	既然可透过团体协约要求改善劳动条件
T	在运动方面表现优异的钱薇娟也有音乐天份
T	可能是受到美元贬值的吸引
M	前天友谊华侨贸易部开了个迎新春座谈会
T	丰富的动物造型是其玉器的特色
T	所内的老人也都很期待这些演出
T	好让一些亘古不变的真理进驻胸臆
T	这与我们一向的刻板形象有关
M	对学生们的影响是显而可见的
M	众多的投资者并不知道
M	焦副矿长问工人还缺什么年货
T	忍不住再用心念一次
M	非国大要求废除一切种族主义立法
