area	text
T	像电话传真邮件快递报纸电视广播图书乃至于面对面的交谈
T	鹿内都会到场仔细观赏
T	立即兵分二路前往查缉
T	今年报名人数较去年同期减少四成左右
M	抢款大盗成过街鼠当场被擒
T	黄乙玲还是他的关门弟子呢
M	于是在山阳城乡就有了这辆黄牌车
M	以经济建设为中心的观念不强
T	徒留韩国队教练在场边吼叫
T	向外界证明如果善加灌溉施肥
M	每四个人中只有一个人能获得安全的饮用水
T	一栋在大门左侧的平房宿舍突然大火四起
T	校长的作风会影响学校的风气
M	这样就形成了一股以团结为重以团结为荣的正气
M	姑娘们孩子们哭出声来
M	这是一个十分艰难的任务
M	而报道的重点又往往是些影视屏幕或歌坛上的明星
T	我自己不太能适应婚姻生活及妻子媳妇的角色
M	医院就派车把老太太接来约会
M	我们是有把握的是成功的
M	去年遇到了市场疲软的形势
M	只有苏联概要地表明了自己的态度
T	基本上这些石头是不会移走的
T	大量阅读与时间的累积是他做学问的不二法门
T	在他新书尚未出版前
T	太阳之子旅北排湾族青年联盟由台北医学院徐超斌等五人成立
T	一般家庭式的小餐盒业一样可以取得ＧＭＰ认证
M	公司杨经理乘坐越野车探险开路护送班车
M	从台湾当局上层人士的大量言论及主管部门的种种措施来剖析
T	定将遭另三队非议
M	比力亨瞄了一眼水泥地面上齐刷刷的４道刹车胎印
M	当她清楚地看到侍候在身边的是一个穿军装的陌生小伙子时
M	这个时候的长虹厂同全国其它彩电厂家一样
M	我们决定于１月３０日结束戒严
T	卖不掉我反而很高兴
M	人们期待着下回分解
T	推荐甄试的考题比联考来的灵活
T	举出了金牌挂身的荣耀
T	现行组织及人才无法有效发挥应有的保险监理功能
T	企图利用中国的银行贷款滚雪球
T	说他是天生的坏胚子
M	而苏联从东欧撤军的势头可能会冲击西方的建议
M	钱要用在刀口上
M	中国活鱼也通过这条海图上找不到的航线
M	山东省的领导班子为什么能这样团结
T	主力刻意于４０００点前压回整理
M	黄岩长潭水库坝顶尽头的山弯上
T	全省各地气温一直都在三十几度
T	为天下太平作出积极的贡献
M	到年末仍有２１亿元
T	有铜瓷玉漆珐瑯文具杂项雕刻等
T	例如一位四五十岁正常肺功能的人
T	包括地方社区大学职业或技术学校公立学校的成人教育单位
M	不偏不倚正好倒在记者脚旁
M	当今世界上却有千千万万的儿童生活在令人窒息的污水浊气之中
T	学籍科至今尚未接到民众申请认定苏联
T	更会加深这种内耗的势能
M	西装Ｔ恤套裙牛仔系列超短裙风衣
M	水质会比西湖还要好
M	八五期间和今后十年
T	医学院的校内风气一向给人封闭不活络
M	也选择良好的服务和购物环境
T	一位黄姓民众驾一辆发财小货车
M	堤上群众的队形也在变换
T	海峡对岸文史知识杂志也将同时选刊我们的文章
T	公务员如有罢工等争议行为则可能被解释为不忠实
T	位近台南车站的国立成功大学
T	可以说眼睛也有饥饿的感觉了
M	黑龙江省在煤电运资金和原材料供应方面
M	陷入警民包围中的歹徒插翅难逃
M	便同书记商议了几句
T	也就是一般公认的世界宗教已历经两千年的发展
T	镇公所秘书古义河民政课长李正雄和代表会秘书卓钦河等人
M	然后察看皇岗口岸的情况
M	这些菜不仅品种多质量好
T	所以学生应先看纸质再问价钱
T	选择的空间将更大
M	这些人挖门子盗洞子到你家去
T	怪兽的特殊装置总有它更难缠的地方
M	各级领导要从政治高度认识克服形式主义的重要性
T	第一项特点是它的比赛场地是像一般运动场跑道一样的环形赛道
T	李总统在该球场旧九洞击球时
M	封死口袋活而不乱
M	服务不好也是造成库存膨胀的重要原因
T	目前虽已有万客隆以大型卖场的方式进驻
M	直向着大沙头方向逃去
T	这是执政的中国共产党在把中国大陆拖入文化革命的浩劫之前制造的中华民族空前但愿也是绝后的灾难
M	他们都被破格授予副教授职称
M	在山里各庄乡刘庄子村被困了大半天
T	之后高宝树所送的案子一再被退稿
T	政治或经济剧变都会导致学校撤销与工作有关的训练计划
M	变科研生产两张皮为两个轮子一套马车
T	海湾合作理事会六个会员国目前正与伊朗直接会谈
M	是为了确保社会主义的民主制度得到巩固和发展
M	其余１５家则因快速折旧还贷负担或刚刚投产等原因而未能获利
T	就如同人要爱国孝亲一样
M	也曾干６个小时歇６个小时
M	８９岁的退休工人李久堂
T	何必遭受这种难题呢
M	应该避免采取有可能引起外界批评的行动
M	靠河边那横七竖八的乱石
T	或者出现冷酷之貌漠然的态度等
M	出于爱护李放的身体
T	据南都化学制药公司副董事长黄水源表示
M	因经营不善而亏损的仅有８家
T	其他四类则不在乎
T	它与北平智化寺音乐西安鼓乐开封大相国寺音乐山西五台山音乐并列为中原五大古乐
M	市委市政府大力倡导廉政勤政
T	也会产生突变的情况
T	以它古典风味的故事
M	就是砍我一条腿
T	将在实施全民健保法前夕
M	复杂断块油田的潜力就存在于各种复杂情况之中
T	巴黎和这里有什么不同
M	二是深化投资体制改革
M	江南中街办事处在新村绿化带违章建房
M	写了一封动情的信寄给远方的母亲
T	沈孟生是华视八点档新戏现代追夫族制作人李蝶伦的干弟弟
T	虽然业内主力可能想以滚大量方式突破盘整格局
M	和吕鸿宾共事几十年的村会计杨进躬身进屋
T	我们利用麦哲伦探测机来进行金星地表上的探测活动
T	水稻生长期涵盖整个第二期稻作
T	ㄑ是毛克力人猿泰山的名字的回力刀ㄇ是摸摸头ㄩ是鱼缸养小鱼ㄊ是踢踢球ㄓ是叉叉大树枝
M	即实现安哥拉和平的基本原则停火协定解决安哥拉人民共和国政府和争取安哥拉彻底独立全国联盟之间尚存问题的构想
T	就可能会发生员工抗拒受训主管中途放弃的状况
M	紧紧依靠亿万人民群众的历史主动性和创造精神
T	其职员不准他们自由地窥探北韩官员
M	苏联坚决支持巴勒斯坦人民在巴解组织领导下争取恢复民族权利建立独立的国家的正义事业
M	刺耳的刹车声不时响起
T	且有围墙包围住整个酒店
T	这阵土城蚵仔面线的流行风
T	但车上鸡笼却翻覆农田里
T	迎合产品少量多样的趋势
M	人们对问题的解决尚抱着期盼
M	质量达到了超优标准
T	另外还有淡江登山社从嘉明湖顺走至新康山
T	南部机动组昨天展开同步取缔行动
T	五至七千人派在衣索匹亚
T	该局担心的不仅是经费有限
M	原来议定春节前给熊书记写封汇报信
T	说他从来没爱过我
M	比去午同期增长４．７％
M	今后如何在消费税问题上找到同在野党的妥协点
T	或可替饲主遥控犬只
M	滋润着人们渴望真善美的心田
M	上海的飞达北京的长城天津的津达高档名牌时装开始在村镇和山区落脚
T	因此已经反映出六成五的企业界预期这波不景气会再持续
T	赛前林庆龙则看完跑道后表示
M	这些归心似箭的旅客急着要和家人团聚
T	国内最著名的大型赫兹租车
M	专门负责往桥墩上运水泥
T	为史料的保存近代史的研究
T	使用的机车也大都是欧洲的车种
T	使得台湾都市的热岛效应日渐明显
T	其评分标准会有差异
M	肯德基公司在上海独领风骚的喜悦维持仅一年
T	他们的生活方式并不像今天我们这个样子
T	只要对人诚恳持之以礼
T	实在不必有太多联想与误解
M	允许黎某在该地上搞种养业建厂建住宅等
M	除中央放着一块小巧玲珑灰白石头
M	但也是实实在在的问题
T	收视率第一的节目即使只超过友台一
M	只有以决战决胜的姿态
M	没有排除美国有一定的伤亡
M	都得听上一句您买几双袜子吧
M	而是坚定不移地贯彻了全心全意依靠工人阶级的指导方针
T	背叛老师就是违背真理
T	最后战胜了加拿大对手派翠西亚
M	它说明封建迷信思想在部分农村中还颇有市场
M	这家上下两层的第二连锁店
M	发现不少企业的金银奖牌或奖杯不是摆在销售科展销室
M	苏联还希望能够作为亚洲的一员
T	由于柏油必须在高温溶解成液体时才能作画
T	对于陈进兴作为不时有强烈的针砭之词
T	共同开发涵盖新闻综合资料库新闻专业资料库及分散式资料库三大范畴
T	而受到香港汇丰银行昨天宣布业绩报告的影响
M	饮料要喝原汁的
T	此一量级中华队廖星洲原被看好
M	卡车三面车帮放平
M	这次会议确定了我市今后一个时期发展的战略目标
M	难道我们非要等引起北京市民的反感和讨厌
M	在场的人都佩服他那惊人的记忆力
T	各剧团在竞赛时翻修老戏
T	可由雷达穿透云层来探测地表
T	都坐在电脑键盘前敲入资料
M	中苏之间的贸易额大幅度增长
M	就违反了联合国宪章精神
T	六日与十二日的乖离率相当高
T	一年就三斗六升了
M	功能过剩是价格高的一个重要原因
T	主要因其兼具易操作及高稳定度等优点
T	其它非入侵案件像毁谤恐吓等还是需要透过司法单位方可协助查证
T	不禁使人想起天真的女孩误吞鸟卵而怀孕生子
M	从而使体教两家优势互补
M	冲到公路上挡住了一辆出租车
T	以寄销式直销入偏远地区的每一个家庭
T	国内知名艺术家吴炫三昨日表示
M	中国政府对长期稳定地发展中日贸易持积极态度
T	创造社会资本并开发精神资源
M	推行一国两府一国两地区
M	双方部长级会议再次重申了尽快缔结条约的政治意愿
T	其内容是针对社会上重要议题而设
M	全省人民为之骄傲和瞩目
M	攻击伊拉克的沙漠风暴行动已经开始
M	但最令人心疼的是文学院和法学院图书馆里许多册的藏书
M	矿车发出咣当咣当的滚动声
T	大部分的种类都采用点水的方式
M	后面一位小伙子插上来
T	较去年同期以美金计衰退百分之零点一
T	那有自我肯定的成就感呢
T	让我们定出正确的政策
M	可说此亦猫匿儿也
T	小学时钱薇娟同时是乐队与篮球队的成员
M	现已开发的老油区
M	领导干部要带头学习邓小平同志关于加强党风廉政建设和反对腐败的一系列重要论述
T	科学家愈来愈相信在生化学上而言眼睛与胃之间必定有密切的关联
M	在地球是个小村庄的当代社会
M	南非当局采取的这些举动
M	必须加强成员国在政治经济领域的广泛协作
T	赫斯特估计该公司去年大部份的员工利用工作时间参与训练课程
T	尚有二五五家公司迄未申报
M	在实际工作中我们仍然存在着诸多不尽人意之处
M	改革无偿分配住房及低租金的制度
M	身手矫健的运动员们又将在未来创造如何的记录
M	全世界麻风病患者约为１１００万人
T	另外还有成千上万的军队在其他许多国家
M	金牌大省的处境着实可怜
T	代表散户普遍由空翻多且大肆扩张信用
M	美国和苏联驻在欧洲的军队各方应削减到２７．５万人
M	可以划出一块地方叫做特区
T	诗与词仍有很强的内在联系
M	沈太福不但没有发起财赚到钱
T	心里对人事物的成见亦无法一致
T	这可说是型天蝎座的一般倾向
M	这类报纸也很难卖出
T	却未能得到社会相对的肯定
M	当我们向姜春云核实情况时
M	中村区区委书记阮荣全挤进人圈
M	毛在藏文诗歌中的意思是母亲
M	带给我们的不仅仅是几块以飨口腹之欲的炸鸡
M	到处充满了现代化的气息
M	他又从这代价中学习着在学校中从未学过的知识
M	儿媳乔焕过给她准备了两床被褥
T	依本法抚恤之公务人员
M	我心里非非常的高兴笑声
T	指林在屏市厚生里四维路八十一号二楼开设赌场
T	不让过去的包袱成为未来成长的茧
M	尽早建设煤气工程集中供热工程污水处理和垃圾处理工程以及绿化生态工程
T	眼中的台湾是个讲自由很容易的地方
M	杨尚昆主席授予钱学森同志一本红色荣誉证书
M	突破就存在于固守之中
M	这对我们来说可能是一个坏消息
M	不足以遏制腐败现象的蔓延
T	而成人教育又不融摄历史意识社会良知和宗教情操的高远理想
M	副总工程师陈桂棋和值班工长告诉记者
T	甚至挨一记拳头喔
T	并明定公务员不可以罢工
T	结果本院以７５比４５胜分
M	小靳拿在手里温和地说
M	均取得令人满意的治疗效果
T	所以一般人的体力均可应付
T	且精业亦愿提供资料库相关技术能力
M	请给上面捎个活
T	恐怕宋教官夫妇遭不测
T	儿童性虐待问题常会使儿童长大后因心理伤害而沦为雏妓
T	游行预计在中正纪念堂正门集合
M	预算难产的原因正在于此
M	前面一道斜坡挡住了去处
M	把深圳建成现代化国际性城市
M	外地来找我的一天不下二三十家
M	发挥了体教两家协同作战的优势
T	内容包括电影名人讲座学术座谈以及歌仔戏表演等
T	其他的立委则依大法官会议解释文于今年年底前退职完毕
T	当反伊军事活动仍持续进行之际
T	配偶仪式因不同族而相异
M	也有思想认识跟不上形势变化的阻滞
T	台证则仍在申请中
T	他的不成熟及无责任感为忧虑二
T	此文的确指出了本院一项严重的缺陷
T	也不急著立著发表研究成果
T	理应了解并尊重我国商标法制
T	则未来的中国恐怕将难免永远被人类历史除籍
T	甚至民营者都不可罢工
T	还会要求饲育人员不得养宠物
T	也就是为师之道和为生之道
M	去年９月密特朗在联大会议上提出了解决海湾冲突的四点方案
M	城市是政治经济科学文化的中心
M	完全符合党中央国务院的精神
T	卅八岁被依校规记二大过处分
M	沈阳锅炉公司负责人毫不讳岂地对记者说
T	但由北京的国际合拍公司协助下
T	锁定客户群区隔需求筛选商品分期分类促销
T	心思台湾人民活在没有是非观念
M	仅医学院那些教学设备就价值１０００万美元
T	美国哲学会创立于本世纪初
T	而已排定开发的工业区投资案需要大量资金
T	名人赛于胜光羽球馆进行的赛程部份
M	记市人大常委会关于城市规划管理条例的讨论
T	并报经经济部核准支持才实施
M	一些有争议的问题需要解决
M	海部如此匆忙赴美与布什举行会谈
T	怎么可能估算出动物的生理压力值
T	南宋理学家朱熹在岳麓书院讲学时就生徒云集
M	使住房资金不能实现投入产出的良性循环
M	作为国家领导阶级的中国工人阶级具有很高的政治觉悟
T	法国人则以优闲的心情享受人生
M	太阳系唯一拥有碧海蓝天的地球出现了危机
M	３亿元的改造资金从哪出呢
T	艺文界人士找不到生存的空间
T	文明体系因相互歧视而引发的冲突
T	该研讨会除详细介绍主从架构整合性解决方案及资料库前端开发工具应用实例外
T	其中套装软体业者有２０％的成长
T	公元投资信托有关主管表示
M	同那里的干部群众一起
T	也是社会迈向现代化的集体性向测验
M	占全省粮棉油和主要经济特产收购资金总额的百分之七十五
T	学历的认定只采认最高学历
M	若要较起真儿来
T	否则这种说辞很容易引发黄祸的负面形象
T	就因为黑名单及省籍歧视阻挠
M	这些文件的签署扩大了中苏关系的条约法律基础
T	滨南工业区七股湿地的经济发展即将使黑面琵鹭成为绝响
T	但该处噪音之严重美术水准之低下
M	雨后的兰考县焦裕禄烈士陵园
T	所以宏科会有部份搭配的动作
T	但当公司业绩狂跌加班时间骤减
M	沈阳军区某炮兵团参谋长
M	也一定会有下文
M	必须克服那种国家课题你争我夺
M	东北三省拥有大庆鞍钢一汽等１７００多家国营大中型企业
M	中国共产党继续坚持并且发展了同各民主党派的合作
T	外汇基金的另一作用
T	因应未来这场新通路革命
M	但是这名现已出生的婴儿目前健康状况仍很严重
T	成为继雕刻家朱铭赴英国皇家南岸艺术中心展览作品之后
T	香港差不多全部入口货品都是免税的
M	是南北矛盾长期积累并日益加剧的结果
T	在维护自由时采取极端主义
T	目前有关民俗或古迹之旅的营队
M	它是远远超过了资产阶级民主的人民民主
M	没准我还能得个名次呢
T	也极可能于明年六月拆除重建
M	不时还插上三两句
M	堵塞该堵塞的某些漏洞
T	又从找不到检验单位
M	我们还要唱这支歌
M	受到有关部门和行业的欢迎
M	各成员国对德国统一原则上都表示支持
M	并以此来振奋民族精神
M	就一些种稻技术问个没完
M	在全国军事运筹学会和军事系统工程学会年会上发表
T	除政务官及民选人员外
M	法美两国把分歧搁置一边
T	家庭的情形亦复如此
T	由语竹二字的笔画算来
M	军火工业需要更多地依靠国际市场才能生存下去
M	制度不好可以使好人无法充分做好事
T	小女孩送他们一只叫杰比的小红猪
T	让各种思想在校园中自由流通
T	但有一个最大的缺点
T	多位县议员并针对所谓官商勾结内幕大加鞭挞
T	巨人队此役共击出支安打
T	其理由即与公务员服务法之公务员身分有关
T	柏杨版资治通鉴第六十册大中之治述及唐武宗灭佛的始末
M	为迎接竞赛做题三千多道
M	而且从今年４月起商业部门再次停收我厂产品
T	联队也有支安打表现
T	这是因为前三年民间投机风气拉大贫富差距
T	但台湾青少年的阅读物市场并没有多大的改变
M	记者证和钱被售票员推了出来
M	住房作为商品进入现实生活
T	丰富的动物世界还有待你继续去观察研究
M	让我们为填会海而共同作艰辛的努力吧
M	但这仅仅只是一个开端
T	同时并将配合出书胡适编选绝句一百首
M	一衣多季变为一季多衣
T	但卫生单位处理接踵而至的吸安者验尿问题
T	可以带给子女更多的幸福与快乐呢
M	全民职工何为马路天使
M	为国家建设奉献了大半辈子
M	挫败以当局的大以色列计划
M	公司技术服务中心的几个小伙子一面散发咨询表格
T	而韩国队金彦挺举表现甚佳
M	几乎只对中国产的工艺品之类感点兴趣
M	还十分需要我们的肉类和其它食品
T	以利该公司开凿新井
M	是中国工人阶级的光荣传统
M	到２０００年要实现国民生产总值再翻一番的目标
T	以维路面及水源污染的防制措施
T	所以几乎已成为使用得最广不可或缺的储存媒体
T	而价格亦要求不超过底价者始得参与总分计算
T	七十是人生的一大步
M	我们广大发展中国家已经失去了发达国家工业化时期所具有的资源和生态环境优势
T	其实近几年竞赛时
M	密特朗再次对这个把两德会谈置于４个战胜国会谈之前的提法
M	出现了新的不平衡
T	虽有近四十个成员
M	特别是在经济领导部门和经济理论界引起很大震动
T	更不能代表多数人的意见
T	譬如听听老一辈的同事们说起从前如何如何
M	苏惠娟赖亚文李国君许新等运动员一一与总书记握手
M	这家总投资近１０亿元的中德合资企业
M	今天已经成为兰考大地的现实
T	因为基隆市与台北市的管线大小不同
M	连一些暂栖身的团结户也不甘落后
T	从而养成上课不专心听讲的坏习惯
T	所以我们还是挂著它的招牌
M	黑人和其他少数民族在政治教育就业各方面一直受到歧视
M	丹麦的托·伦德和珀·杜蓬特２
T	财政部在等央行形式公文的回函后
T	同辈和老师的意见都是她改进技艺的重要帮助
T	皮草牧场必须设法交配出毛皮颜色特殊的貂
M	９名大学生营业员新组建成电脑部后
M	为了使企业走出困境
T	路经南市裕农路八００巷内复兴国中后垃圾场农路
T	但愈多的乐器来表现一首歌曲会愈讨好
M	以国营或集体企业为龙头
M	这座桥还有一个不同凡响处
M	一度成为风云人物的沈太福
M	一个叼着香烟的厂长开口了
T	份量太多未能煮完的部份
T	新竹县市新闻西滨公路竹北段业主陈情
M	记者采访了武警的一位上校政委
M	我去姥姥家取钥匙
T	对于违背自己心意的人
T	于十二日中午至卫生署要求全面暂缓实施全民健保法
M	输出军火不仅仅涉及商业利益问题
T	期与伊拉克的军事威胁相抗衡
T	行政院研考会主任委员马英九及国大代表刘香谷
M	为每个下井的工人送一个桔子塞一把糖说一句安慰活
T	而赋予他的特殊命名
M	他频频出入于歌厅舞场游乐厅
M	舍孔雀而取凤尾
T	这样虽会加重同学念书的压力
T	所有屋内墙壁都是书架
T	香港亦有许多吸引游客观光的好地方
M	２＋４会议诞生和消失的启示
T	我自己是抱著一种非常轻松的心情参加这次甄试
M	而偌大的东北三省只有三席
M	泰安市委书记王建功对记者说
M	构成种族隔离制度支柱的集团居住区法居民登记法土地法独立家园制度等
T	林嫌供称被害人好像是强暴其妻的涉嫌人
T	第一员工并无意愿利用闲暇时间来学习
M	可也错过了提升的机会
T	他向宋主席反映这个事件后
M	北约主张开放两大军事集团所有成员国的所有领土
M	挖掘资源潜力最现实最能短时间奏效的地区仍然是东濮凹陷
T	那么对精神传统的认识
M	促进台湾与大陆的早日统一
T	也就面临了双方人选的条件比较
M	过去那种过于集中的体制
T	以及财政部金融局组织条例制定草案
T	宋教官夫妇被押上车时
T	成为全球首份可以在网路上订阅的主要电子报纸
M	全是产自中国大陆的商品
M	并不仅仅表现为表象美
M	更多了些冷静和理性思考
T	在各种行业制度及生产工具中起积极作用的软体结构
M	当时任中共中央政治局常委中顾委主任的邓小平同志
M	卖起了西瓜冰糕汽水羊肉串及蛋卷面包等
M	美国人对通货膨胀的担心与日俱增
T	全美二十三场说明会中
T	中国画家以水墨笔砚渲染自然的山与水
M	省顾委纪委人大政协济南军区省军区以及各人民团体
T	目前各升学补习班收费均压低
M	发挥他们在政治协商活动中的积极作用
T	高雄廖伟成得到趋势科技提供之笔记型电脑一台
T	仍使我们很明确看出二氧化碳平均浓度逐年上升
M	他半夜十点当当敲门
M	台湾当局对两岸经贸关系的发展存在着三种心态
M	决定从减少指挥程序实现指挥自动化方面考虑
T	而这对小公司来说
T	尽管此片在美国的反应并不好
M	我心里真不是个滋味
M	装的过程本身就又是一个扩散源
M	到处是鸟粪和垃圾
M	名列世界第二的斜拉桥的英姿风采
T	这个为学术和文化的进步
M	难道在那些扰乱社会治安毛贼面前反而束手无策不成
T	而在小时的课程中
M	美丽如画的深圳怡景花园内
M	焦书记却不回来了
M	党给了我新的生命
M	事情总有不顺利的一面
M	库存膨胀当须紧急刹车
M	北京市区有读报习惯的约有５００万人中
M	他是早上７点钟来排队的
T	与厂商支援及维护能力
M	安盟领导人萨文比前天中止了在葡萄牙的访问
T	但是球迷会与打篮球带来的其他有形无形的收获更多
T	如果你想知道电脑如何大显神通
M	有的还要升起几个气球
M	总不能让大娘没脱离危险就回去吧
M	为了达到这一不可告人的目的
M	记沈阳军区某炮兵团参谋长苏宁
T	所以将这些设施开放给各学校学生使用
M	我死后只有一个要求
M	体教结合使湖南省的体育和教育部门都尝到了甜头
M	又是长期的市场战略的需要
T	但却很难发生师生大辩论
T	虽然代表们各有未出席代表会临时会的理由
M	养金鱼是他的一项雅趣
T	而不是由伊拉克总统海珊所决定
M	南朝鲜总统和民正党总裁卢泰愚民主党总裁金泳三共和党总裁金钟泌昨天在青瓦台举行会谈后宣布
T	警方据报赶往在现场拾获二枚弹头一个
M	在一名主管副县长的直接领导下
M	我市是具有一定优势的
T	又将肛门朝著豆荚洞口
M	且助长不惧法规法律的刁蛮之风
T	何必去膜拜一盘豆子呢
T	对大盘更增添了稳定筹码的功效
T	并发展便捷的大众交通系统
M	省防汛指挥部接到中央防汛指挥部电令
T	其中规定公务员可以组织区域性之协会组织
M	指出这将造成我国产业结构失衡
T	如由非工会之组织或团体或集合一群人之罢工均被视为非工会罢工
M	但为什么江南中街办事处在原规划设计图的绿化带大兴土木
M	其国民生产总值仅低于美日两国
T	也采较慎重的态度
T	在未公布前市场人士自然是采观望态度
M	努力使各方面的工作按正常秩序进行
M	广大群众对此早有议论
M	而且应该是一个优美的生活与劳动环境健全的生态系统可供永续开发利用的自然资源
