area	text
T	除了应具备专业知识外
T	却是他人格与风格的完成时期
T	老板看我一个孤零零的外国人
T	周经人送医急救无生命危险
M	杨永康陈学东陈青华
M	显示了石油工业在发展国际贸易和技术交流方面
M	金泳三为了争当下届总统
T	桃园警方日前召开主管会报
T	台北焦点工业区变成大卖场
M	某次列车某号轮船几时到汉
T	姬莲阿姆斯壮拍新小妇人确实重造了古典电影的某些风貌
M	她还能吹灭１０支生日蜡烛吗
M	安政府和安盟领导人去年６月也在扎伊尔握手言和
M	这公司许恐日后遭报复
M	言行与人恰若表里
M	某君曾苦笑诉衷肠
M	批准拥有上市公司股份的国有企业
T	我们也可以陆续解开包覆在浓密云层下金星的秘密
T	便关系调查成果甚巨
T	开除不去受训的员工
T	法新社体育新闻竞选中常委落马会否加入新党张丰绪
T	赫斯特并不是采取裁撤基本技能需要加强的员工
T	和澈底改变社会对女性的刻板观念
T	还有什么能比夫妻用心经营一个妈妈爱爸爸
M	要是把它降价处理了
M	他又部署军警采取联合行动
T	两侧则是孝瑞和孝靖后的
M	卢荣景同志的女儿要赶１２点的车
T	然后在家犬的脖子上套上一枚接收器
M	张晴大娘家里收获１０００公斤小麦
T	便由新登基的皇帝为其圈定殉葬人员
M	整个经济形势正在继续向好的方面发展
M	为贯彻落实中央工作会议和党的十三届八中全会精神
M	面对荣华鸡咄咄逼人的攻势
M	中国的长治久安和社会发展就有了重要的政治保障
T	举行捷运木栅线车站接驳设施之问题与对策座谈会
M	这个开发区还提供了税收三免三减
T	首先磁头移动到所欲读写的磁轨
T	可能是一种雏形的核子装置
T	法人的买盘在未获激励的情况下
M	乔石抚摸着孩子的头意味深长地说
T	所以投资人可自行斟酌以纳入投资组合
T	这是政府首度对科学的发展有了长期性的规划
M	这里依然是文人学生光顾之地
M	工业总产值由０．８４亿元增加到１３．１８亿元
M	我们就更没饭碗了
T	浅粉色的貂因为天生的残障
T	这套节目还有一些特色
M	香港就有了社会稳定的基础
T	去年十二月份消费者物价较十一月份下跌百分之零点零六的主要原因是
T	此时千万不要站在其面前
T	学生会活动部应用数学系一年级萧世昌说
M	首要的是抓好第一大战略
M	直到安理会要求伊拉克撤军的最后期限到期之时
T	并参加一通的特殊训练后
M	番禺县国土管理部门规定
M	改善和营造一个舒适的购物环境以方便顾客
M	１５辆车全部经住检验
M	我国的李永波和田秉毅在半决赛中以２
T	七十二日平均线成黄金交叉后
T	诚征灵活成熟负责能独当一面人才
M	这个合同比镇村签订的合同多了建住宅一项
M	东京外汇市场收盘价格为１美元兑１３８．０７日元
M	并非不分青红皂白一概否定
M	但力主在联合国决议范围内行事
M	沈太福就从集资款中一次提出２００万元
M	初时我们以为是来建小公园的
T	女权会也邀请台湾大学劳工社社长宋欣颖民进党新潮流总干事刘世芳尚理仪器公司总经理卓玛莉奇岩社区发展协会理事长蔡丽琴
T	孤柱埋入地下深度六台尺
T	这和一般牧场在养牛和羊时完全相同
M	如果把广州正常的生产工作生活秩序搞乱了
M	有人问一位刚领上钱穿着皮茄克的漂亮姑娘
M	在废墟中掏扒药品
T	甚至前年台北国际马拉松他还以三百多名的成绩抵达终点
T	山镜记则改编自文姬归汉
M	最后是２占了上风
T	对其学校行政或其他缺失之处
T	缩短上市流程和降低生产成本
M	承认现安哥拉政府为直至选举之前的安哥拉政府
T	他也自我调适的很好
M	英国反对党工党外交事务发言人布朗说
T	前者却是创作者必要的自觉
M	报告把中国政府为人民做的一些好事
M	不久前在案犯以高价倒卖时被查获
T	所以在中价位市场潜力备受看好的今天
M	战后欧洲这种旧格局已分崩离析
T	何况我还吃台湾米啊
T	目前学生申诉评议办法学校已通过
T	台塑下一步是乖乖让六轻回观音工业区
M	他痛心地对记者说
T	积极与各位代表设法连络
T	新的产业价值链正在形成
M	此时的长虹厂领导并没有慌了心神
M	是由民正党提出来的
T	阅读来自蓝图手册及备忘录等工作上天天可见的资料
T	做一名年轻的农夫
T	今年九月廿五日中午十二时许
M	一位老人在一家国营大商店要买２０厘米大小的高压锅圈
T	因此要在一个组织做到主管经理人员
M	也震动着苏宁的心
T	信义区一个废纸回收业者说
M	一位不知名的小伙子也伸臂奔来
M	塔里木胜利钻井公司党委副书记苏仁堂的母亲
M	我们在一经营布料柜台前停了下来
T	希望能将此预防教育纳入教会的主日学课程中
T	只好留待下回造访了
T	因此仍呼吁各老师在规定日常的国语科作业时应多有创造性
T	如果将国大宪研会翻译成外文
T	由北宋徽宗初立规模
T	若使用者能体会到资料保全的重要性
M	使各油区逐步形成以油气产业为主
T	目前故宫还正在编印三十册的清宫台湾史料
M	更加尖锐地摆在全世界面前
T	且特别是对高科技工业而言
T	文章前提到北京是个方城
M	羽坛老将李永波和田秉毅获男子双打亚军
M	门口买票再赔上几十分钟
T	才有了月里物语这部作品
M	阿拉伯世界正在采取反击措施
T	其盛期预估提早逾三星期
T	其中玉璧与玉琮蕴含了天圆地方的宇宙观
T	使全程毫无冷场出现
T	为能顺利完成此集合机械土木电机等各项技术的振动台建造
M	这并不是因为它有什么振奋人心的业绩
M	当朱穆之贺敬之陈昌本等有关领导上台向演员祝贺演出成功
T	则由歌仔戏明星杨丽花领衔主演吕布与貂蝉
M	5名官兵立刻照医生的建议将产妇抬到楼顶平台
M	还不时有拖拉机汽车响着喇叭驶过
T	基于科技发展不断创新和产业升级转型的迫切需要
T	生物组的主题是如何推动我国生物技术之研究与发展
M	应该明确造成目前环境恶化的历史和现实的主要责任
T	由于淡水高尔夫球场的旧九洞场地
T	而比较基本和重要的肺功能检查有二项
M	７．５万平方米新建的货场可以同时装卸１００多个车皮
T	上市前加贴在商品盒套
T	或阶级等强烈的根源意识纠缠在一起
T	以八万四千元被选入味全队
T	赖谷英行参议员开完记者招待会后
T	金融资本也许需要流动经营
M	吃住都在天安门广场
T	且最坏的情况将在未来一年后出现
M	一字排开１５辆崭新的金杯牌天蓝色卡车
M	感触最深的一点是这里的生产组织结构落后
M	我们不宜再打扰北京市民了
T	今年春节疏运计划仍照原定计划作业
T	面对淡水河口及观音山的风光水色时
M	它反映了时代的变迁
T	待遇不公平加上同事的冷嘲热讽
T	把铁钉先搁置在冰箱冷冻
M	他们推派了２０名代表上岸
M	找准复杂断块油田的潜力所在
M	就等于抓住了深圳的未来
T	几位创办人请了专家
M	环境文化也发挥了大作用
M	作为第一个跨越海峡进京参赛的大型体育代表团成员
M	并表示今后保证不搞下级批评给小鞋
M	我们不可能以能源材料的过度消耗来保证第二个和第三个战略目标的实现
T	大部分词人对封建时代妇女的痛苦
M	还特地派老伴到必经路口当了望哨
T	将在男二舍及女六舍各设一个
T	为了加强年底新戏中演员的脸部表情
M	江泽民总书记就国营大中型企业普遍存在的劳动生产率的增长大大低于职工收入增长比例这一突出问题说
T	销售的清单中包括销往伊拉克内政部
T	哈达否认伊拉克曾提出与该组织会谈建议的报导
M	大胆推出一些符合市情的规章条文
M	当时也有人好心地劝告他们
M	制订了保证完成今年各项任务的措施
T	可以还他一个本来面目
T	再从南管排场乐曲组织调式结构及主要乐器形制来看
T	于五月二十二十一日星期五六假学术活动中心第一会议室召开
M	联合国儿童基金会的数据资料表明
M	新华社记者郑庆求人民日报记者陈维佛
M	而是冷静地思考和观察
M	在今天这么一个隆重的场合
M	这个理论填补了军事运筹学研究的空白
T	旅游局已编列一千多万元预算
M	省市县领导列成一排
T	急于收回以允诺竞选时许下的竞选诺言之一
M	原则通过并不是说就可以实施了
T	而固定基础则透过四十余公尺长之基桩
T	这里也曾是各大媒体记者蜂拥而至的地方
T	许绩胜于一九八八年参加香港国际十公里路跑
T	玉山路线则有政大两队八大玉山及玉山八通关路线
T	你必须从基层做起
T	管理学院该项规定是属于该院的单行法规
M	但一说起他所创办的北京长城机电科技产业公司以下简称长城公司
T	第一阶段由专责机构办理统一考试
M	为了满足国民经济建设的需要
T	更可建设ＮＩＩ资讯高速网路的骨干
M	宣布了对这个战士的处分决定
T	她说每次带团都告诉游客
M	是生死悠下去心关的
M	双手紧握司机程贵宝的手
M	总理一行赶到滁州市琅琊乡粮站
M	既怕三通影响台湾安全
T	昨日召集人古荣郎乃率同小组成员温瑞鹏曾廷华何德光及里长谢阿钦等人
T	这是自从韩战结束南北韩分立三十七年以来的头一遭
M	基本解决了人民的温饱问题
M	其中有三项居世界领先水平
T	向美国烈酒商灌输多次开放时间及多重公卖利益的观念
T	参与社会运动不啻为自我反省定位
T	对当地不熟的机车骑士行经该处时
M	农户耕种一遍手过
M	有妈的孩子像块宝
M	凡是符合中央精神和实际情况
M	而集资修路建桥等
M	一些行业盲目发展而国家和人民急需的住宅生产得不到发展
T	大家回想一下我们是如何面对匿名的电话干扰
M	要照顾好江泽民同志
T	二山胞母语之语汇词书
T	让他们看六亿年前的地球
T	是故宫第一次与民间连线合作
M	城市建设和环境综合整治本来就是一个整体
M	产品由农场按市价统一收购和销售
M	我从不能按我希望的样子长
T	迪吉多个人电脑事业部副总经理石国扬表示
M	是为了防止将来台湾经济受制于中共
M	如认为台湾与大陆经济的竞争大于互补
T	环保局协助校方进行跳蚤消毒
T	张老师自民国六十年起从事劳工辅导工作
T	让我觉得人和是公司成功最重要的事
T	是如何和印象中刺绣雕花的纺织服装设计
M	都已近２０年没换过水
M	明天又冒出了个李家沙陈家沙
M	在余震中抢救被埋群众
M	日商独资的厦门浦田服装有限公司总经理佐藤忠良在接受记者采访时说
T	本周大盘将遭到二道均线关卡
M	美国国务院这次发表的人权报告一改往年的惯例
M	能源供给的缺口将高达３０％以上
M	操作工人们说得好
T	自一九八三年十月十七日港元与美元采取挂勾紧盯的方式以来
T	去年十二月消费者物价总指数为一百一十一点五四
T	在这个政策的架构下
T	月球于三时二十八分退出地球半影
T	在全国上下为对日贸易赤字
M	基本上保证了全省农业升温的资金需要
T	田再庭都主张妨害公务罪的初犯应提升至与杀人犯同样的层次
M	摊棚费１万５千余元
M	才４．５０元一副两条
T	同时引发他使用柏油作画的创作力
T	在高山观测通常气温很低
T	景阳冈出现吊睛白额猛虎出林伤人
T	因此才会形成头也不回的涨势
T	重甲级比赛韩国队选手林仁浩第一回合以一比四的比数落后我国选手林雅仙
M	便是寻找点刺激来打发日子
M	还是购买１９９０年国库券最合算
T	同时也有浓厚的娱乐效果
T	但这笔预算已遭删除
T	红山玉器在辽宁与内蒙古东部
M	并使荣华鸡披上中国传统饮食特色的羽毛
M	其中逾期不还的约占２５％由此较大影响了银行效益
M	也是我省纠正行业不正之风的开场锣鼓
M	还是一次对伊拉克军队的攻击
M	剔肤见骨找病根
T	如果你使用品质工具及持续改善
M	就因为不重视经营环境这个软包装
M	而广大劳动人民不仅谈不上拥有参加管理国家大事的民主权利
T	四公务员不能罢工之理由
T	黑格勒对设定一套订制的电脑辅助的训练计划
T	同时于当地作抽血检验
M	威海市的领导也这么说
M	我评上三星级售货员之后
M	浙江省农业银行信用社多方提供农业生产所需资金
M	在我国最大的工业企业鞍山钢铁公司钢铁奔流声中
T	仅仅在网路上提供广告机会针对本土极有限的市场
M	要正确处理好防治点源污染与区域性综合整治的关系
T	热岛效应是指都市中由于大量的废气及冷气排热建筑物及道路的蓄热绿地稀少等因素
T	卅五岁坦承提供场地及赌具供人聚赌
M	老叶给女儿们订了个家规
M	我们商场里共有２２名
M	其目的是要打破目前在野党势力大于执政党所造成的困难局面
M	由于水体污染引起的疾病每年就造成４０００万儿童的死亡
M	维护中国共产党的领导地位
T	该乡代表赖进权并随时突击检查拍照
T	心脏方面会有心脏扩大心肌梗塞情况
M	当他得知妻子在地震中遇难时
M	从而对华尔街股市的信心下降
T	超过四分之一的小型企业表示意图改善员工的基本技能
M	９时３０分闹新房闹出了新花样
T	例如班级的最低人数限制
T	使新台币持续面临升值压力
M	政府这个条例两次末被通过
T	怀有理想或自鸣清高的社会新鲜人
M	苏联副总统亚纳耶夫日前也对记者说
T	常常写得很靡很淫
T	已是中国与国际文坛上的大师级人物
T	以免唤醒人们对纳粹二次世界大战入侵回忆的莫斯科
M	家住东湖之滨的藻类学家饶钦止
M	我们还可以从税收劳务等方面得到益处嘛
M	她努着嘴用力吹灭了生日蛋糕上的９支蜡烛
T	而邓如雯对自己的遭遇也仅陈述经过
T	其立场与北约组织无甚大差别
M	谁在民主上的发言权就多
M	还是那些虽不能登大雅之堂但急用实在
M	是指一个集团的成员国允许另一集团成员国的非武装飞机在临时通知的情况下
T	和愿意负担所有运动员及职员的来回机票及食宿
T	在展示场也有上百家的电脑厂商展出相关产品
T	犹懒懒的赖在舒适的床铺上
M	日方入超为５９．２４亿美元按中方统计为１４亿美元）
M	历史和现实的情况还告诉我们
M	可这个医院摔伤碰伤的病人抢救不了
T	老师也称师父亦师亦父
T	昨天返国的中华台北游泳队领队立委张世良表示
T	至于支气管扩张剂在此种病人早期使用上的效果仍有待证实
T	有的影印店也会提供熟客人特别的折扣
T	是中国瓷器的登峰造极之宝
M	他毅然留在了工地
M	变成了郁郁葱葱的刺槐林
T	也是因为宾士也有此款车型
M	但更多的人刚为此忧心忡忡
T	警方现正准备循线侦查
T	但仍无法获得农民谅解
T	由学代会议长或社团合作代理学生会的事务有缺点
T	已经无法稳定供应都市的需要
M	要严格遵循互不干涉的原则
M	焦裕禄去世已经２６年了
M	作为国际贸易金融中心和航运中心的香港
T	并不像私人机构必须考虑成本问题
T	世界新秩序正在酝酿之中
M	消除在同当局谈判等问题上的分歧
T	平镇工业区内宝荣纺织公司宿舍及仓库
M	言与行的不一
T	置物柜应该是为了方便学生使用而设置的
T	此次六千万元现金增资案
T	一椎一椎的椎了下来
T	是去年同期的十六倍
M	成为现在的拥有固定资产５９００万元
M	一顿饭就吃掉２万多元
T	环保局发放药剂极利于校方自行施用
M	针织商场经理刘铁讲得更明确出录音
M	春节前后的一个月内
T	连花苞都被咬得稀稀烂烂
M	意即偷偷的隐蔽的见不得人的背后的动作
M	占全国总数的１／７强
T	保持一定的距离观察事物
T	除了招牌戏码武松打虎之外
T	再想想有多少色情服务在全球电话网上横行
T	张仲武交给居庸关守将两把大刀
M	对省委的前几任老书记
M	不做不利于安定团结的事
M	东濮凹陷的勘探还大有文章可做
T	其余的则必须根据公司的需求而定
M	他们从形象化思想教育着手
M	这是社会主义的一个基本特征
M	个别住宅区的狗们三五成群
T	采较保守的策略进出
M	这个长达１５６９页的预算咨文有两点引人注目之处
T	沈世杰先生为日本东京大学水产研究所博士
T	随时环伺在一边等著大捞一笔的主力群
T	由于国父纪念馆近年来不断采间歇性的内部维修
T	本中心亦与位于纽约大学水牛城分校的美国国家地震中心建立长期合作关系
T	依食品卫生管理法施行细则第十条规定
M	这次由于包括向多国部队追加９０亿美元援助的第二次补充预算和有关的财源法在参议院获得通过
T	也不是泛泛可比
M	二是使学生的文化学习和运动训练有机结合
M	一是弥补了场地经费不足和器材配套的缺陷
T	ＷＷＷ网路为传统依赖上课书报的学习方法
T	强调校方长期漠视学生权益
M	为北大西洋联盟带来了一堆棘手问题
M	打破封闭自守的一厢情愿思想
M	无论下次联展再怎么富丽堂皇
T	硬碟中的所有资料均备份
T	才顺利的走上音乐之路
T	认为宋教官的说词有问题
M	中国人民是有志气和有力量的
M	振奋精神敢为天下先
M	苏宁对现代战争的研究和思考早在１０年前就开始了
M	糊了他一脸一身
M	经营企业的人去看一看这个专利市场
T	他们第一次留下来陪阿公阿妈吃午饭
M	自去年初邓小平同志视察南方发表重要谈话和党的十四大之后
M	那时本厂经历了第一次打击
M	赞扬他高尚的品质值得全军炮兵指战员学习
M	红的绿的白的黑的相映成辉
T	再于今年台湾区运动会夺得男子一万公尺冠亚军的我国长跑名将许绩胜和王珍辉
M	两国在年底前均提高了利率
M	特别是塔里木盆地勘探与开发
T	范振宗的竞选诺言端正政风言犹在耳
T	因为所邀请的主持人演讲者皆为各方俊彦
T	女生留在槟榔部落学编织花冠和卑南歌舞
M	闺女硬逼着给退了
T	提供国内的商业贸易资讯如厂商名称产品
M	医院已把他老伴接来相会
M	连队对其作出处分时
M	１９９１财政年度的预算赤字不得超过６４０亿美元
T	中国大陆近年不断有文物出土
T	昨天香港股市中的地产股疲软不振
M	歌声勾起了女大校友们对战争岁月的无限思念
M	还要以大中型骨下企业为依托
M	这两派派头安倍晋太郎和渡边美智雄是公认的海部之后首相宝座的有力竞争者
M	说些连自己都不太相信的传闻和道理
T	虽然不是使用专为比赛设计的纯种赛车来竞争的比赛
T	以及出资收购这四个范围
T	从事写作演讲主持笔会编辑词典等
M	一位居民对记者说
M	弄得大家都很尴尬
M	其主要原因是两国间存在第二次世界大战中被苏联占领的北方领土问题
M	能够起到缓解库存矛盾的作用
T	再由教育部二中选一
T	在讨厌人情纠纷的型气质中
M	莺飞草长新枝绿
T	当中共代表队到达后发现会场上有中华民国国旗而感到奇怪
M	没个框死的限定
M	日本对联合国和平维持活动的合作措施等
T	周遭的市井人们亦多几乎抱持看好戏的兴奋心情津津乐道科技武器精准雄伟的道具功能
T	二日参加宝桑部落主办的联合丰年祭
T	劳资争议处理法修正草案中已将上述公用事业之四种行业人员列入不可罢工
T	附近的东峰路因为在拓宽
T	透过由制作人出面拉拢友台艺人拍戏
T	业主们一年多以来多次抗议的风波
T	深度工作知识的蓄积需要长期专一企业的历练
M	打算送报社以扩大影响
T	利用ＶＩＳＳＲ拍摄的云图可以测定昼夜的云分布
T	学校曾表示已无多余的教室可用
T	鼎盛两家尚未与复华签订转融通契约致无法进行融券业务
T	里面整齐的陈列著他的中英文著作及书信原稿
T	画前总是站满了景仰赞美的观众
T	不能只重视课本上的知识
T	外人说古迹具有保存价值
M	让拉萨保持经常整洁美丽
T	停止破坏科威特及战斗性飞行
M	打破了国外对我国的技术垄断
M	她辞旧迎新之夜是在车床旁度过的
M	少数人或许仍然拘泥于纯计划经济的库存观念而不以为然
M	在生产物资供应方面全部单列
T	赴美日公演两周
M	潜力就存在于复杂变化之中
M	他盗用了一张不该由他支配的支票
M	从出海口向上游汹涌奔腾而来
M	他先后搬迁了十多次
M	他就不必面对向他讨债的人了
T	经警方报请检察官曲鸿煜前往验尸后
M	从街道两旁大多数居民家中的窗口
M	对这种报纸也就倒了胃口
T	让柏油更具丰富色彩
M	体教两家在抓学校体育时都存在片面性认识
T	如果是老师指定的作业大致找得到
T	有两行特别醒目的大字
T	消费是一种随个人生活环境中各项主客观因素而变化的行为
T	逢回档为汰弱换强的最佳时机
M	到底没提出一条意见来
M	旅客在海口车站买到经柳州中转的火车票后
T	仍然是亚洲企业求之不得的管理人才
T	成功的企业会衡量本身实际情况
T	这些破坏行为引起师生的不满
T	是新竹示范区不变的原则
M	它将给日本９０年代的政局带来重大影响
M	越来越多地表现为物化商品中的科学技术水平的竞争
T	但是别人对你的成就仍然大打折扣
M	同时又要尽量减少争议
T	以作为发展社会福利基金
T	最教人惊讶的是在针对少女犯罪人数及类型的统计中
M	真知灼见与谬误荒唐俱在
M	在这里按照人们的意志
T	反而是考夜大的短期班冲刺班与高职学生报考的技术学院二专的补习班
T	很少有推心置腹的朋友
T	并索取免费赠送之保健箱
M	平时娇气十足的战士朱国才鼓足勇气站起来说
T	于三年前来亚洲创办这项大赛的约翰走路父子公司
M	也许能通过对长虹现象的深入讨论
M	原定的婚期推一推
M	记者在长安县纪杨乡王寺村一块田头
T	她以我的璀璨生涯一九七九年一鸣惊人
T	由台湾大学学生会法学院学生会大陆问题研究社所举办的寻找新台湾人系列从二二八到族群融合活动已于二十二日展开
M	是中苏新型关系的重要内容
T	李总统临去前和斗南国中全体教职员合影留念
M	旨在通过加强成员国之间的经济合作
T	举行男人性事不轻谈读书会
M	这不是青年人的婚礼
T	可说是为师为道殉难
M	这个亲家是经不起来的
T	将代表我国参加一九九三年世界卧举比赛
M	在进入高含水期以后
T	回台湾找了十四个研究生
M	中华人民共和国的首都心中是十分景仰的
M	在美国苏联和葡萄牙政府的安排下
M	特别是国家机关利用职权乱收费
T	大约三分之一小型企业的经理人也都表示
T	和公权力之行使不可分和民生必需品没有任何关连公用事业
M	厂长王霞看着台下一张张热情的脸
M	约旦埃及伊拉克和阿拉伯也门４国元首
M	而是我们在领导上管理上和制度上所存在的严重弊端
M	他购买了六千元１９９０年的国库券
M	充分发挥电影寓教于乐的作用
T	在齐白石老人自述中不胜枚举
M	留个心中的纪念而已
T	迈向一个完备的民族博物馆
T	因此老师在规定作业时应让学生了解做此项家庭作业的目的及期望
M	在全县中小学中组织了田径训练８条龙
T	他们又有什么能耐与学问去替我们开会宪研呢
M	他给检察长的信中写道
M	他成立了长春长城科技集团公司
T	台湾妇女白皮书是由女学会的成员依自己所研究的领域
M	老子随便说上几句
M	炮院又应合肥市委的请求
M	他们就已手持亚运会徽旗
T	对于这种怪兽装置操控自如
T	是截然不同的两种风貌
M	一群一团的人支起了枯树枝棺材板
M	他恰在一个多梦的年龄
M	听别人说搞情报能赚钱
T	使各支空气弹簧均能平均受力
T	它虽然改善了病人的生活品质也确实延长病人的部分生命
M	中共安阳市委专门在这里召开现场纪念会
T	学生在这次彩绘活动表现得非常理性
T	他不知道应互相体谅关怀
M	这次国库券发行条件比较优惠发行一段时间后
M	全国企业总亏损面达３７％
M	通过多条途径多种办法在全市范围内努力形成一种培养人才吸引人才
T	但希望能有较方便的查询系统
T	这些改进的工作是值得去做的
M	使美国某些反华势力在中国实行和平演变的图谋落了空
T	可见他受人推崇的程度
T	私立高雄工学院非法取水
T	不但为左传及史记的记载做了有力的印证
T	如果有不具优秀的分析能力
M	建设有中国特色的社会主义公有制企业的经验
T	加上其目前尚含丰厚权值
M	这家企业非但没有象多数彩电厂家那样一筹莫展
M	正在我省考察工作的中共中央政治局常委乔石同志
M	但２＋４会议这一新词
